title,link,content
KBL과 마블이 만났다…롯데마트 토이저러스 팝업스토어 진행,https://n.news.naver.com/mnews/article/008/0005282691,"롯데마트 토이저러스, 마블 테마 KBL 팝업스토어 진행. /사진제공=롯데마트 롯데마트 토이저러스가 오는 28일부터 다음 달 7일까지 롯데백화점 잠실점 2층 '키네틱 그라운드'에서 월트디즈니 컴퍼니 코리아와 KBL 이 함께 선보이는 마블( MARVEL ) 테마 KBL 팝업스토어를 운영한다고 25일 밝혔다. 이번 팝업스토어는 2025~2026 시즌 LG 전자 프로농구 정규리그에 맞춰 한국농구연맹( KBL )과 디즈니코리아가 협업해 선보이는 것으로 마블 히어로 캐릭터를 활용한 한정판 제품을 만나볼 수 있다. 팝업스토어에선 농구 유니폼, 키링, 티셔츠, 파우치 등의 기획 상품 300여 개를 판매한다. 특히 이번 협업 제품은 프로농구 10개 구단별로 마블 히어로들을 매칭해 제작됐다. 다양한 체험형 현장 이벤트도 준비했다. 28일부터 다음 달 2일까지 구단별 KBL 대표 선수 팬 사인회와 해당 선수와 함께하는 '슛 챌린지'가 진행된다. 또한 현장 팝업스토어를 방문해 상품을 구매하는 고객에게는 구단별 한정판 포토 엽서를 증정한다."
"에누리 가격비교, '가족 건강 위한 현명한 건기식 구매' 캠페인 나서",https://n.news.naver.com/mnews/article/030/0003373579,"에누리 가격비교는 다음 달 16일까지 '진짜를 원한다면? 에누리 건강플러스' 캠페인을 전개한다고 25일 밝혔다. 이번 캠페인은 에누리 가격비교가 지난해 자체 개발해 운영하고 있는 '건강 Plus 전문관'의 우수성을 알리고 올바른 건기식 구매 문화 정착에 앞장서기 위해 기획됐다. 에누리는 건강 Plus 전문관의 차별화된 혜택을 고객이 쉽게 알 수 있도록 '엄마가 선택한 진짜 건강기능식품 전문관'이라는 홍보 영상을 제작했다. 소비자와 소통 확대를 위한 이벤트도 실시한다. 에누리 가격비교, '가족 건강 위한 현명한 건기식 구매' 캠페인 나서 영상을 시청하고 해답을 맞히는 참여형 방식 퀴즈 이벤트다. 정답자를 추첨해 갤럭시 위치8부터 풀리오 프리미엄 마사지 매트, 신세계 상품권(10만원) 등 다양한 경품을 제공한다. 건강 Plus 전문관은 식약처에서 인증한 건기식만을 엄선해 유효성분부터 섭취 방법, 최저가 비교 등을 제공한다. 소비자가 정확하고 신뢰할 수 있는 제품 구매를 돕는 역할을 목표로 내걸었다. 에누리닷컴 관계자는 “건강 Plus 전문관이 일상 속 가족의 건강을 챙기는 동반자로 자리잡도록 최선을 다할 것”이라고 말했다."
"이마트24, 조선호텔 손종원 셰프와 손잡고 간편식 6종 출시",https://n.news.naver.com/mnews/article/008/0005282689,"이마트24가 손종원 셰프와 협업 간편식을 선보인다. /사진제공=이마트24 이마트24가 조선호텔 손종원 셰프와 협업한 프리미엄 간편식을 선보인다고 25일 밝혔다. 신제품은 손종원 셰프와 스태프들이 매일 함께 즐기는 일상식에서 영감을 받은 '패밀리밀( Family Meal )' 콘셉트의 간편식이다. '패밀리밀'은 셰프 업계에서 셰프와 스태프들이 브레이크타임에 함께 나누는 '일상식'을 의미한다. 레스토랑 메뉴는 아니지만 집밥처럼 따뜻하고, 동료들과 나누는 특별한 한 끼라는 점에서 이번 프로젝트의 핵심 아이디어가 됐다. 손종원 셰프는 ""셰프들도 결국 가장 편안한 맛, 가장 따뜻한 순간을 찾는다""며 ""이번 시리즈는 실제로 직원들과 즐겨 먹는 레시피를 바탕으로 만들어 고객들이 믿고 선택할 수 있는 간편식을 목표로 완성했다""고 말했다. 이마트24는 셰프의 일상을 그대로 구현한 이번 콘셉트가 고객의 호기심과 구매 욕구를 자극할 것으로 기대하고 있다. 또 '일상식'이라 해도 셰프 기준의 높은 맛·품질 검증을 거친 만큼 편의점 간편식 수준을 한 단계 끌어올리는 계기가 될 것으로 보고 있다. 오는 26일 △떡갈비정식 도시락(5900원)  △엄마반찬삼각(2200원)을 시작으로  다음달 초 △함박얹은 나폴리탄스파게티(5500원)  △스리라차마요참치김밥(3600원)  △아보카도듬뿍 CBLT 샌드위치(4200원)  △뉴욕스타일베이컨샌드위치(4200원) 등 6종을 순차적으로 출시한다. 이마트24는 이번 출시를 기념해 12월 한달 간 손종원 셰프 협업 간편식 상품을 대상으로 다양한 프로모션을 진행한다. '떡갈비정식 도시락' 구매 시 컵라면(육개장 소컵)을 증정하고, 나머지 5종 상품은 행사 카드로 2개 이상 구매 시 50% 할인 혜택을 제공한다."
"삼성, 中 바이오텍 프론트라인에 전략적 투자",https://n.news.naver.com/mnews/article/031/0000983676,"라이프사이언스펀드 통해 투자⋯차세대 항암 모달리티 ADC 개발 중 삼성은 바이오 분야 신기술과 사업 개발을 위해 조성한 '삼성라이프사이언스펀드'를 통해 중국 항체약물접합체( ADC ) 개발사 프론트라인 바이오파마에 투자한다고 25일 밝혔다. 라이프사이언스펀드는 삼성물산과 삼성바이오로직스, 삼성바이오에피스가 공동으로 출자해 조성한 벤처 투자 펀드다. 삼성벤처투자가 조합을 결성해 운용 중이다. 삼성바이오에피스 사옥 전경. [사진=삼성바이오에피스 제공] ADC 는 글로벌 시장에서 빠르게 성장 중인 항암 모달리티(치료법)다. 암세포 등에 잘 달라붙는 항체에 항암약물(페이로드)을 링커로 결합해 암세포를 정밀하게 타격하는 기전으로, 차세대 항암 모달리티로 평가받는다. 프론트라인은 이중 항체와 이중 페이로드 기술을 기반으로 한 ADC 를 개발 중이다. 이 기술은 약물 전달 효율을 높이고, 기존 단일 표적 ADC 의 한계로 지적된 내성 및 종양 이질성 문제를 개선할 수 있다. 현재 이중 항체 ADC 의 글로벌 임상을 진행 중이며, 내년 1분기에 이중 항체·이중 페이로드 기술이 적용된 ADC 의 임상 진입이 추가로 예정됐다. 삼성은 프론트라인 투자를 통해 유망한 미래 사업 발굴과 ADC 분야의 핵심 연구를 강화할 수 있는 협력 기회를 적극적으로 모색할 계획이다. 투자 금액 등 구체적인 내용은 공개되지 않았다. 앞서 삼성바이오에피스는 지난달 프론트라인과 ADC 공동연구 계약을 체결하고, 파이프라인 2종의 공동 개발권과 페이로드 1건의 독점권을 확보한 바 있다. 이번 투자는 삼성이 프론트라인과의 협력 구조를 더욱 공고히 하기 위한 조치로, 장기적 파트너십 강화를 위한 전략적 행보로 풀이된다. 서민정 삼성바이오에피스 상무는 ""프론트라인과 파트너십에 이어 투자까지 진행하면서 글로벌 ADC 시장에서 의미 있는 기술적 영향력을 확보해 나갈 것""이라면서 ""앞으로도 다양한 파트너십과 투자를 통해 미래 기술에 대한 준비를 한층 강화할 계획""이라고 전했다."
"현대백화점그룹, 광주에 스마트 교통안전 솔루션 설치 지원",https://n.news.naver.com/mnews/article/018/0006171084,"광주 서림초에 '스마트아이' 설치비 1억원 지원 ESG 경영 일환…""어린이 교통 안전 개선되길"" [이데일리 김지우 기자] 현대백화점그룹이 초록우산어린이재단과 손잡고 어린이들의 안전한 등하굣길 만들기에 나섰다. 광주광역시 북구 서림초등학교 앞에 설치된 세이프스쿨 솔루션 (사진=현대백화점그룹) 현대백화점그룹 지주회사인 현대지에프홀딩스(005440)는 안전한 어린이 교통안전 환경을 조성하는 ‘세이프 스쿨’ 캠페인의 일환으로, 광주광역시 북구에 위치한 서림초등학교 정문과 후문 앞 교통사각지대에 스마트 교통안전 솔루션인 ‘스마트 아이( Smart Eye )’를 설치했다고 25일 밝혔다. 세이프 스쿨 캠페인은 초등학교 인근 교통사고 우려 지역에 사고 예방을 위한 인공지능( AI ) 카메라, LED 모니터, 스피커 등을 설치해 영상과 음성으로 운전자와 보행자에게 위험을 알리는 교통안전 솔루션 구축 사업이다. 현대백화점그룹은 이번 광주 서림초등학교에 스마트 아이 두 대를 설치하는데 필요한 비용 1억원을 지원했다. 앞서 지난 2023년에는 서울시 관악구에 위치한 원신초등학교와 청룡초등학교에 스마트 아이를 설치한 바 있다. 현대백화점그룹이 안전한 어린이 교통안전 환경 조성에 나선 건 그룹 ESG (환경·사회·지배구조) 경영의 일환이다. 현대백화점그룹은 ‘리그린( Re.Green ), 위드림( We.Dream )’을 그룹의 ESG 슬로건으로 삼고, 환경보호와 사회공헌을 통해 지역사회와 소외계층을 아우르는 다양한 활동을 펼치고 있다. 현대지에프홀딩스 관계자는 “미래의 주역인 어린이들의 교통 안전 개선에 조금이나마 도움이 되길 바란다”며 “앞으로도 지역사회에 안전망을 구축하는 다양한 활동을 펼칠 것”이라고 말했다."
"‘과로사 의혹’ 런던베이글뮤지엄, 개선안 내놨지만… “미봉책 불과” 지적도",https://n.news.naver.com/mnews/article/366/0001125675,"‘쪼개기 계약’ 비판 후 첫 대책 나왔지만 고용 안정성 확보, 가장 큰 과제 “휴게 시간 명확화, 체계적인 직무 교육 필요” 직원 과로사 의혹 논란이 이어지는 런던베이글뮤지엄(법인명 엘비엠)이 근로환경 전면 개선을 약속하는 사과문을 발표했지만, 소비자 반응은 냉담하다. 핵심 논란이었던 고용 구조와 업무 강도 문제에 대한 근본 대책이 부족한 탓이다. 런던베이글뮤지엄 매장./런던베이글뮤지엄 제공 25일 관련 업계에 따르면 엘비엠은 지난 17일 강관구 대표 명의의 사과문과 함께 ▲고용 안정성 제고 ▲법정 근로시간 준수 ▲안전보건 시스템 강화 등을 골자로 하는 ‘근로환경 개선 계획’을 발표했다. 강 대표는 “근로환경을 근본부터 다시 점검해 안정적이고 안전한 환경을 만들고, 구성원들과 함께 성장할 수 있는 기반을 마련하겠다”고 밝혔다. 그러나 업계에서는 핵심 쟁점을 비껴갔다는 반응이 이어지고 있다. 소비자들도 소셜미디어( SNS )에서 “문제의 본질은 여전히 그대로다”라고 지적한다. 단기 계약 중심의 고용 구조, 직원들이 장시간 노동을 반복할 수밖에 없었던 운영 방식 등이 큰 틀에서 유지될 전망인 탓이다. 엘비엠의 개선안은 일정 부분 진전된 조치지만, 앞으로 제도 개선이 얼마나 촘촘하게 이뤄질지는 지켜봐야 한다는 것이다. 엘비엠이 사과문에서 언급한 내용 중 가장 큰 변화는 3개월 수습 이후 1년 단위 계약을 도입해 단기 계약을 줄이겠다는 대목이다. 지난달 국정감사에서 엘비엠은 한 달 또는 석 달마다 ‘쪼개기 계약’을 했다는 비판을 받았다. 근무 기간이 3개월 미만이면 당일 해고가 가능하고, 한 달 치 임금인 해고 예고 수당을 지급하지 않아도 된다. 엘비엠은 이를 개선하기 위한 조치로 3개월 수습 ·1 년 단위 계약을 언급했지만, 노동계에서는 근본적 문제는 그대로라는 평가가 나온다. 초단기 계약에서 1년 계약으로 바뀌었다고 해서 불안정 고용이 완전히 해소된 것은 아니라는 것이다. 정예지 BF 노동법률사무소 노무사는 “수습 기간이 3개월이라는 점 자체는 근로기준법상 불법은 아니지만, 도의상 수습 기간 이후에는 바로 정규직으로 전환하는 게 맞다고 본다”고 했다. 이어 “향후 수습 기간 후 1년 계약직이 기본 형태로 유지된다고 해도 재계약 압박, 고용 안정성 부재 등의 문제는 반복될 수 있다. 1년 3개월이 지난 후 고용주가 계약을 해지할 수 있는 것 아닌가. 결국은 미봉책”이라고 했다. 실제 엘비엠의 고용 불안정은 유사 기업들과 비교하면 두드러진다. 일하는시민연구소가 최근 발표한 보고서에 따르면 지난 3월 기준 커피 프랜차이즈 메가커피는 정규직 비율이 71.6%, 이디야는 79.4%인 반면, 엘비엠은 런던베이글뮤지엄을 포함한 4개 브랜드 근로자 총 750명 중 정규직은 3.2%(14명)에 불과했다. 엘비엠 측은 “노무·인사 전문 컨설팅을 통해 비즈니스 특성에 최적화된 인력 구조를 설계해 정규직 비율을 점진적으로 높일 것”이라고 했다. 런던 베이글 뮤지엄 주요 메뉴./런던베이글뮤지엄 제공 아울러 엘비엠은 근무 기록을 본사에서 직접 모니터링하고, 지문인식기·보안시스템 기록을 연동해 실근로시간을 교차 확인하겠다고 밝혔다. 이는 외형상 근로시간 준수를 위한 조치지만, 노동자 감시만 강화될 수 있다는 우려도 나온다. 논란의 핵심은 과도한 업무량과 인력 부족인데, 근태관리만 강화한다고 해결될 문제가 아닌 탓이다. 엘비엠은 또 바쁜 시기에 인력을 1.5배까지 늘려 업무 부담을 줄이겠다고 밝혔다. 그러나 인력 확충만으로는 숙련도 부족, 품질·안전 편차, 잦은 교체로 인한 업무 비효율 문제를 해결하기 어렵다. 프랜차이즈 업계 관계자는 “베이커리에선 직원 숙련도가 품질·안전·작업 효율을 좌우한다. 기간제 중심의 고용 구조가 유지되면 문제가 발생할 수 있다”고 했다. 프랜차이즈 업계에선 엘비엠의 이번 발표가 큰 방향성은 제시했지만, 실제 변화를 위해서는 보다 구체적인 제도 설계가 필요하다고 입을 모은다. 업계 관계자는 “단순히 바쁜 시기에 인력을 1.5배 늘린다고 하는 것이 아니라 하루 생산량, 매장당 투입 인원, 피크타임 인력 배치 등 세부적인 기준을 마련해야 한다”며 “휴게 시간 명확화, 체계적인 직무 교육 확대 등도 함께 이뤄져야 한다”고 했다."
"이랜드 미쏘, '그런지 Y2K' 캠페인 공개",https://n.news.naver.com/mnews/article/421/0008623202,"2000년대 그런지 감성 재해석한 캡슐 컬렉 미쏘( MIXXO )는 '그런지 Y2K' 캠페인을 공개했다.(미쏘제공) (서울=뉴스1) 김진희 기자 = 이랜드월드(035650)에서 전개하는 여성 SPA (제조·유통 일괄) 브랜드 미쏘( MIXXO )는 '그런지 Y2K' 캠페인을 공개했다고 25일 밝혔다. 미쏘는 이번 캠페인을 통해 '오래된 폴더 속에서 다시 꺼낸 2000년대 감성'이라는 콘셉트로 약 20년 전 패션을 현대적으로 재해석한 캡슐 컬렉션을 선보인다. 컬렉션은 △풀오버 니트△데님 팬츠 △롱스커트 등 그런지와 Y2K 감성을 함께 느낄 수 있는 아이템으로 구성됐다. 대표 상품 '스냅단추 슬림 후드 풀오버'는 슬림한 실루엣으로 몸매를 탄탄하게 잡아주는 실루엣이 특징이다. 앞면 가시 스냅 장식을 따라 자연스럽게 형성된 Y라인 디테일로 포인트를 더했다. 신축성 있는 소재로 편안한 착용감을 제공하며, 스커트, 팬츠 등 다양한 하의와 믹스매치가 가능하다. '기모 벌룬핏 데님'은 볼륨감 있는 하의 실루엣을 연출하기 용이한 아이템이다. 안감 기모 처리로 한겨울까지 포근하게 착용할 수 있다. 다크 그레이 색상 팬츠에는 아웃심 스터드 장식으로 다리 라인을 따라 은은한 포인트를 더했으며, 그레이쉬 인디고 색상 팬츠에는 자연스러운 워싱감을 표현했다. '기모데님 롱스커트'는 하체를 자연스럽게 감싸주는 A라인 실루엣으로 체형을 보완할 수 있는 아이템이다. 빈티지한 워싱이 적용됐고 부츠와 매치해 겨울시즌 데일리룩으로 연출하기 좋다. 이랜드 미쏘 관계자는 ""2000년대 그런지와 Y2K 감성을 현대적으로 재해석한 캡슐 컬렉션을 준비했다""며 ""기모 소재와 트렌디한 실루엣으로 구성한 이번 컬렉션을 통해 따뜻하면서도 감각적인 겨울 스타일을 완성하길 바란다""고 말했다."
"'베러 베이직' 열풍에…CJ온스타일, 프리미엄 타월·식기 매출 '쑥'",https://n.news.naver.com/mnews/article/119/0003029174,"(왼쪽부터) 앳센셜 체크스트라이프 선염타월, 아르노글래스 4인 세트.ⓒ CJ 온스타일 [데일리안 = 이나영 기자] CJ 온스타일은 지난달 20일부터 이달 15일까지 리빙 카테고리 주요 제품 매출을 분석한 결과, 타월·식기·침구 등 일상 필수품의 프리미엄 가격대 제품 매출이 전년 대비 260% 증가했다고 25일 밝혔다. 이는 매일 사용하는 ‘기본 아이템’을 호텔·레스토랑급으로 업그레이드하는 ‘베러 베이직’ 트렌드가 확산되고 있는 것으로 분석된다. 집 전체를 리모델링 하지 않더라도 생활 단위별 핵심 제품만 고급화해 일상 만족도를 높이려는 실용적 프리미엄 소비가 빠르게 자리잡고 있는 것이다. 특히 프리미엄 타월 매출은 전년 대비 1346% 증가하며 가장 높은 성장세를 보였다. 약 10만원 가격대의 ‘앳센셜’이 성장을 견인하는 대표 브랜드로 자리매김한 가운데 지난달 21일 모바일 라이브 방송 ‘은세로운 발견’에서 소개된 ‘호텔이슬라’ 타월은 20만원대 구성임에도 30분만에 1억원 이상의 주문을 기록했다. 프리미엄 식기·커트러리가 214% 증가한 점도 눈에 띈다. 마르디 메르크디로 유명한 피스피스 스튜디오의 크리스탈 브랜드 ‘아르노글래스’는 지난 7월, 9월 성공적으로 런칭을 마쳤다. 이와 함께 40만원 가격대의 ‘리옹 사바티에’ 커트러리 제품도 모바일 라이브에서 약 3000만원의 주문금액을 기록하는 등 집에서도 레스토랑 분위기와 식사의 완성도를 높이려는 수요가 늘었다. 또한 버미큘라, AMT 등 프리미엄 냄비 브랜드도 높은 매출을 견인하고 있다. 프리미엄 침구(베딩·베개) 역시 248% 증가하며 호텔식 수면환경을 원하는 수요도 확대되는 추세다. 이제는 침구를 소모품이 아닌 ‘컨디션 관리 아이템’으로 인식하는 흐름이 강해지며 노르딕슬립, 크리스피바바와 같은 호텔식 베딩 수요가 강세를 보이고 있다. 최근에는 싱크볼까지 하이엔드 키친 감성으로 교체하는 추세다. 대표 브랜드 ‘아티잔’은 1차, 2차 방송 완판에 이어 지난 10월 주문 매진을 기록했다. 주방의 핵심 공간을 고급화해 체감 만족도를 높이는 생활 단위 업스케일링 경향이 뚜렷해지고 있다. CJ 온스타일 관계자는 “가전·가구 중심이던 프리미엄 트렌드가 타월·침구·식기처럼 가장 자주 쓰는 기본 아이템으로 확대되고 있다”며 “보여주는 소비보다 일상에서 자기 만족과 감각 경험을 중시하는 베러 베이직 리빙 트렌드는 내년에도 더욱 확산될 것”이라고 말했다."
"""어린이 등하굣길 챙긴다"" 현대백화점그룹, 광주에 교통안전 솔루션",https://n.news.naver.com/mnews/article/003/0013619489,"(사진=현대백화점그룹 제공) *재판매 및 DB 금지 [서울=뉴시스]이주혜 기자 = 현대백화점그룹 지주회사인 현대지에프홀딩스는 안전한 어린이 교통안전 환경을 조성하는 '세이프 스쿨( SAFE SCHOOL )' 캠페인의 일환으로 광주광역시 북구에 위치한 서림초등학교 정문과 후문 앞 교통사각지대에 스마트 교통안전 솔루션인 '스마트 아이( Smart Eye )'를 설치했다고 25일 밝혔다. 세이프 스쿨 캠페인은 초등학교 인근 교통사고 우려 지역에 사고 예방을 위한 인공지능( AI ) 카메라, LED 모니터, 스피커 등을 설치해 영상과 음성으로 운전자와 보행자에게 위험을 알리는 교통안전 솔루션 구축 사업이다. 현대백화점그룹은 이번 광주 서림초등학교에 스마트 아이 두 대를 설치하는 데 필요한 비용 1억원을 지원했다. 현대백화점그룹은 '리그린( Re.Green ), 위드림( We.Dream )'을 그룹의 ESG (환경·사회·지배구조) 슬로건으로 삼고, 환경보호와 사회공헌을 통해 지역사회와 소외계층을 아우르는 다양한 활동을 펼치고 있다."
프리미엄 키친의 새 기준 …伊 모듈노바가 제안하는 리빙·다이닝·키친 토탈 솔루션,https://n.news.naver.com/mnews/article/020/0003676870,"독자적인 기술력-모듈형 디자인으로 토탈 인테리어 솔루션 제공 모듈노바의 신제품 버티컬( Vertical ) 37년 전통 이탈리아 통합 인테리어 솔루션 브랜드 모듈노바( Modulnova )가 리빙, 다이닝, 키친 등 토탈룩컨셉으로 프리미엄 시장에서 주목받고 있다. 모듈노바는 1988년부터 37년간 이어져 온 이탈리아 리빙 브랜드로, 인테리어 마감재로 사용되던 레진 시멘트 소재 사용과 고유 도장 기술, 모듈형 디자인으로 미니멀하면서도 감성적 분위기를 실현하면서 전 세계 30개국 350개 지점을 보유한 세계적인 브랜드가 됐다. 모듈노바는 키친을 넘어 리빙, 다이닝 등 그 영역을 넓혀 홈 인테리어 솔루션을 제공한다. 각각의 공간에 동일한 소재와 디자인, 디테일을 적용해 집 전체를 하나의 콘셉트로 마감할 수 있는 ‘토탈룩’ 인테리어를 제안한다. 라미네이트부터 시멘트, 세라믹에 이르기까지 400여 개가 넘는 다양한 컬러와 소재 보유는 물론, 고객을 위한 맞춤형 주방 시스템, 제품의 믹스 앤 매치, 알루미늄 허니컴 구조 개발을 통한 기술의 혁신, 슬라이딩 월 유닛( Sliding wall unit ), 스톤 싱크볼( Stone sink ) 등 다양한 디자인과 사이즈의 천연석 싱크 제품 보유 등 LDK ( Living , Dining , Kitchen )를 아우르는 통합 인테리어 솔루션 구현이 가능하다. 이런 품질과 기술력을 인정받은 모듈노바는 아스티 논현, 아티드 강남 등 하이엔드 주거 공간의 선택을 받고 있다. 아스티 논현에는 미니멀한 디자인과 실용성을 갖춘 모듈노바 MH6 키친이 적용됐다. 국내에서 가장 높은 수요를 보이는 MH6 는 한정된 면적에서도 설계의 완성도와 실용성을 극대화한 구성이 특징이다. 또 2025년도에는 신제품 버티컬( Vertical )과 아트( Art )를 선보였다. 버티컬은 기존 일률적인 수평방향의 도어 핸들에서 벗어나 수직방향을 적용한 디자인이다. 석재와 함께 조합된 우드에는 수직패턴이 적용되고, 도어 뒤에는 슬림한 간접 조명까지 더해져 감각적인 입체감을 연출한다. 아트( Art )는 모듈노바가 독점으로 사용하는 석재인 아펜니노( Appennino ) 대리석과 수작업으로 제작된 월넛 마감 도어의 정교한 조합이 특징으로, 기능성을 넘어 오브제로서 역할을 담당하는 디자인을 보여준다. 모듈노바의 국내 공급은 프리미엄 인테리어 전문 기업 ㈜하농( Haanong )이 맡는다. 하농은 해외 하이엔드 마감재와 인테리어어 브랜드를 발굴해 국내 시장에 31년째 소개해온 기업으로, 모듈노바( Modulnova )를 포함해, 조르다노( Listone Giordano ), 리마데시오( Rimadesio ), 라꼬르뉴( La Cornue ), 살바토리( Salvatori ) 등 유럽의 프리미엄 브랜드를 포트폴리오로 보유하고 있다. 하농은 단순한 수입을 넘어 국내 환경에 최적화된 제품 구성, 품질 기준, 설치 노하우를 함께 제공하며 프리미엄 시장에서 높은 평가를 받고 있다."
