title,link,content
"[심층] 대구·경북 소비자, 카드 어디 썼나 봤더니···""온라인 쇼핑 압도적""",https://n.news.naver.com/mnews/article/657/0000045363,"대구와 경북 소비자들의 신용카드 소비액을 분석한 결과 온라인쇼핑 성장세가 뚜렷한 것으로 나타났습니다. 동북지방통계청이 발표한 '카드 데이터로 본 대구·경북 소비 형태 분석' 자료에 따르면 2024년 업종별 카드 소비액에서 온라인 쇼핑이 차지하는 비중이 대구 35%, 경북 27%로 가장 높았습니다. 2020년과 비교하면 대구는 온라인 쇼핑 비중이 5.1% 포인트, 경북은 4.3% 포인트 증가했습니다. 백화점, 대형마트 등을 포함하는 종합 소매 비중은 대구 23.3%, 경북 23.4%로 4년 전과 비교해 대구는 4.3% 포인트 감소, 경북은 3.5% 포인트 감소해 전통적인 오프라인 소비의 비중이 줄었습니다. 대구는 온라인 쇼핑(35.0%), 종합 소매(23.3%), 음식·숙박(11.9%) 순으로 지출이 많았고, 경북은 온라인 쇼핑(27.0%), 종합 소매(23.4%), 운송 교통(15.1%) 순이었습니다. 청장년층 온라인쇼핑 비중 더 높아···대구 20·30대는 절반 이상 40대 이하 청장년층에서는 대구와 경북 모두 온라인 쇼핑 비중이 다른 연령대보다 압도적으로 높았습니다. 대구는 20대 이하에서 50.6%, 30대 51.4%를 차지해 카드 소비의 절반 이상을 온라인쇼핑에 지출했습니다. 경북 역시 20대 이하(45.1%)와 30대(42.6%)에서 온라인 쇼핑 비중이 가장 높았습니다. 성별 소비 차이도 뚜렷했습니다. 2024년 대구 남성과 여성의 카드 소비액 비중을 업종별로 비교해 보면, 남성은 운송 교통(7.7%p), 음식‧숙박(5.3%p) 등에서 여성보다 높고, 여성은 온라인쇼핑(9.5%p), 전문 소매(2.4%p) 등에서 남성보다 높게 나타났습니다. 2024년 경북 남성과 여성의 카드 소비액 비중을 업종별로 비교해 보면, 남성은 운송 교통(13.7%p), 음식‧숙박(5.0%p) 등에서 여성보다 높고, 여성은 온라인쇼핑(13.5%p), 교육(3.6%p) 등에서 남성보다 높게 나타났습니다. 60대 이상 고령층, 보건의료 소비 급증···경북 70대는 운송 교통 ↑ 연령대별 카드 소비 비중에서는 인구 구조 변화의 영향이 감지됩니다. 60대 이상 고령층에서는 보건의료 소비 비중이 크게 증가하는 공통적인 경향을 보였습니다. 대구 70대 이상은 보건의료 비중이 24.1%, 경북 70대 이상은 18.2%로 나타나, 연령대가 높을수록 의료 지출이 커지는 경향을 확인했습니다. 특히 경북의 70대 이상 고령층에서는 운송 교통 소비가 30.1%로 비중이 크게 증가하는 특징을 보였습니다. 일평균 카드 소비액 비중은 대구는 평일 59.5%, 휴일 40.5%, 경북은 평일 60.1%, 휴일 39.9%로 대구와 경북 모두 평일 소비가 약 60% 수준으로 더 높았습니다. 업종별로는 보건의료, 온라인 쇼핑, 운송 교통 등은 평일 비중이 높았고, 종합 소매와 음식·숙박은 휴일 비중이 더 높은 것으로 나타났습니다. 예를 들어, 대구의 경우 종합 소매는 휴일 비중이 평일 대비 12.7%p 높았고, 음식·숙박은 4.5%p 높았습니다. 대구, 인접 지역에 쇼핑·의료서비스 제공···경북은 여행 목적지 지역 간 소비 이동을 살펴보면, 인접 지역 간의 상호작용과 광역 단위의 소비 유출입 특징이 나타납니다. 2024년 대구 지역민의 타 지역에서 카드 소비액 비중은 운송 교통(32.1%), 종합 소매(30.0%) 순이고, 타 지역민의 대구 소비는 종합 소매(41.2%), 보건의료(22.0%) 순으로 나타났습니다. 대구가 인접 지역에 대한 쇼핑 및 의료 서비스 중심지 역할을 하고 있다는 점을 보여줍니다. 유입 지역별을 보면, 경북에서 60.8%가 유입됐고 동남권(15.9%), 수도권(15.4%) 순이었습니다. 경북 지역민의 타 지역 소비는 종합 소매(36.8%), 운송 교통(23.8%) 순으로 높았습니다. 지역별로는 대구가 38.0%로 가장 많았고, 수도권(32.2%)이 뒤를 이었습니다. 타 지역민의 경북 내 소비는 운송 교통(38.3%), 종합 소매(26.0%) 순으로 나타나, 경북이 타 지역민에게 이동 및 여행(운송 교통) 목적지로서의 소비 유인을 제공함을 보여줍니다. 유입 지역별을 보면 대구에서 42.1%가 유입됐고 동남권(24.7%), 수도권(19.9%) 순이었습니다. 이번 자료는 통계데이터센터의 내국인 국내 카드 소비( BC 카드)를 활용해 대구와 경북 지역의 성별, 연령대별, 업종별 비중과 특성을 분석한 것입니다."
"기재부, 설탕·커피 등 수입원료 ‘저율 관세’ 검토",https://n.news.naver.com/mnews/article/021/0002752540,"원·달러 환율 고공행진으로 수입물가가 들썩이는 가운데 정부가 설탕·커피 등 식품원료 수입에 대한 저율 관세 확대 여부를 저울질하고 있는 것으로 파악됐다. 고환율이 이른 시일 안에 진정될 수 없다는 판단에 물가 관리에 나선 것이다. 정부는 널뛰는 환율을 잡기 위해 국민연금까지 활용한다는 방침이지만 부정적인 국민 여론, 미국과의 관계 등 실제 동원까지는 많은 난관이 예상된다. 25일 기획재정부에 따르면, 정부는 현재 내년도 정기 탄력관세 운용 계획 발표를 위한 막바지 단계로 늦어도 12월 초 관련 내용을 발표할 계획이다. 정부는 반도체 등 국가 전략산업 경쟁력 강화 관련 관세 지원을 우선적으로 고려하면서도 물가 안정 부분 역시 고심 중인 것으로 전해진다. 실제로 정부는 물가·수급 안정을 위해 연간 수입 한도 물량을 정해 저율 관세(할당관세)를 적용하는 세제 지원을 이어왔다. 올해는 식품원료 15개, 에너지 4개 등 총 19개 분야에 지원이 진행됐다. 내년에는 설탕 수입 관세를 기존 5%에서 0%(10만t 규모)로 낮추는 방안과 인스턴트커피·코코아 생두에 대한 할당관세 적용 수량을 수입물량 전체로 확대하는 방안이 검토되고 있다. 이상기후에 따라 수확이 감소한 딸기(냉동딸기)를 비롯해 으깬 감귤류·파인애플, 과일칵테일 등도 지원 대상으로 테이블 위에 올랐다. 에너지 부분에서는 프로판·부탄 등 에너지 원료 할당관세 적용 기간이 직전 상반기에서 연중으로 확대하는 내용을 살피고 있는 것으로 전해진다. 기재부 관계자는 “추가 논의 후 최종 결정할 것”이라고 밝혔다. 한편 정부는 환율 안정 대책을 논의하기 위해 전날부터 기재부와 보건복지부·한국은행·국민연금 등이 참여하는 4자 협의체를 출범시켰다. 하지만 국민연금을 적극 활용하기에는 부담이 적지 않은 상황이다. 미래의 노후 자산인 국민연금 수익성 악화 우려가 큰 데다 미국 눈치도 살펴야 하기 때문이다."
양상추 실종 사태,https://n.news.naver.com/mnews/article/021/0002752538,"■ 1년새 가격 51% 뛰어… 햄버거매장 ‘양배추’로 대체 이상기후에 작황 안 좋아져 일부 양상추+양배추 혼합 무료 음료쿠폰 제공하지만 소비자는 “너무나 다른 맛… 군대리아 먹는 기분” 부글 “햄버거에 양배추를 넣는다고 하니 솔직히 좀 놀랐습니다. 처음엔 익숙하지 않았는데 잘게 썰어달라고 했더니 그나마 먹을 만하더군요.” 햄버거를 자주 사 먹는 소비자 김모(25) 씨는 최근 ‘양상추 품귀 현상’으로 햄버거 매장에서 양배추를 대신 제공하자 당혹감을 느꼈다며 25일 이같이 말했다. 이상기후 여파에 따른 양상추 수급 불안으로 최근 양상추 대란을 겪고 있는 햄버거·샌드위치 업계의 고민이 깊어지고 있다. 소비자 반응도 각양각색이다. 양상추가 정상 수급될 때까지 햄버거를 사 먹지 않겠다는 ‘강경파’부터 양배추와 그나마 어울리는 메뉴를 고르겠다는 ‘유연파’까지 다양한 반응을 보이고 있다. 아직 양배추 맛에 적응이 안 됐다는 박모(33) 씨는 “양상추 대신 양배추가 들어간 햄버거는 군대 시절 이후 처음 먹어본다”며 “양배추는 풀 맛이 강해 양상추와는 전혀 다른 맛을 낸다”고 말했다. 양배추에 더 강경하게 거부감을 보인 이모(23) 씨는 “이미 저렴하게 구매한 버거 쿠폰들이 있는데 12월까지 양배추를 섞어준다면 쿠폰을 다 환불하겠다”고 고개를 저었다. 다른 소비자는 “양배추 버거를 안 받고 차라리 양이 적더라도 양상추가 든 햄버거를 주문하고 있다”고 말했다. 한 소비자는 “롯데리아 메뉴 중에선 그나마 데리버거가 양배추 맛과 잘 어울린다”며 “이런 ‘꿀팁’을 여러분과 공유하고 싶다”고 추천했다. 롯데리아 관계자는 이와 관련해 “전국에서 양상추를 공급받고 있는데, 이상 기후로 인해 700g에 수확해야 하는 양상추가 최근엔 350g으로 크기가 크게 줄었다”며 “이달 안에 공급 부족이 해소되기를 기대한다”고 말했다. 실제로 양상추 가격은 2년 새 폭등한 상황이다. 한국농수산식품유통공사( aT )에 따르면 이날 가락시장 경락가격 기준 일반 양상추(상품) 10㎏은 4만2020원으로, 전년 동기(2만7781원) 대비 51.3% 급등했다. 2년 전 가격인 2만3955원에 비해선 무려 75.4%나 가격이 뛰었다. 롯데리아는 이달 중순부터 말까지 햄버거 속재료로 양상추와 양배추를 혼용해 사용하기로 했다. 두 재료 혼용에 따른 소비자 반응도 예의주시하고 있는데, 실제 소비자들 사이에선 다양한 반응이 엇갈리고 있다. 한국맥도날드는 햄버거를 주문한 손님에게 기준 중량에 못 미치는 양상추를 제공해야 할 경우, 콜라나 커피 등 매장에서 사용할 수 있는 무료 음료 쿠폰을 제공하고 있는 상황이다. 한국맥도날드는 “폭염·냉해로 양상추 품질이 전반적으로 떨어져, 가능한 한 좋은 품질을 확보하려고 노력 중”이라고 말했다. 감자 등 다른 작물의 수급 상황도 좋지 않아 버거 업계에선 감자튀김(프렌치프라이) 판매 또한 비상등이 켜졌다. 이날 감자 특품 20㎏의 도매가격은 4만5667원으로, 전년 동기(3만9134원) 대비 16.7% 올랐다."
"쿠팡 알럭스, 패션 블랙 프라이데이 개최…2500개 명품 브랜드 선봬",https://n.news.naver.com/mnews/article/030/0003373684,"〈사진=알럭스〉 쿠팡은 럭셔리 뷰티·패션 버티컬 서비스 알럭스( R.LUX )가 패션 제품을 대상으로 한 '알럭스 패션 블랙 프라이데이'를 내달 2일까지 개최한다고 25일 밝혔다. 이번 행사는 발렌시아가, 알렉산더 맥퀸, 스텔라 매카트니, 프로엔자 슐러, 알라누이, 3.1 필립 림 등 글로벌 브랜드를 포함해 약 2500개 브랜드가 참여한다. 다운 재킷, 코트, 니트웨어, 겨울 부츠, 스니커즈 등 가을·겨울( F·W ) 인기 상품 및 신상품을 선보인다. 알럭스는 고객을 위한 다양한 혜택을 마련했다. 신상품을 대상으로 기간 한정 추가 할인 혜택을 제공하며 50만원 이하로 구매 가능한 럭셔리 패션 상품을 제안한다. 재킷, 코트 등의 겨울 아우터웨어, 니트웨어, 부츠 등 연말연시에 인기가 높아지는 인기 아이템을 키워드별로 소개한다. 이번 행사에서 고객은 시즌성 높은 상품을 보다 매력적인 가격에 만날 수 있다. 알럭스는 지난 6월 글로벌 명품 마켓플레이스 파페치( FARFETCH )'와 파트너십을 체결했다. 이를 통해 전 세계 190여 개국의 고객에게 인기 브랜드와 부티크의 다양한 명품 셀렉션을 선보이고 있다. 고객은 알럭스에서 패션 상품을 로켓직구 방식으로 간편하게 주문할 수 있다. 상품은 전 세계 파페치와 직접 거래하는 브랜드사 또는 부티크에서 발송되며, 알럭스가 최종 국내 배송을 담당한다. 배송은 출고지에 따라 4~7일 정도 소요된다. 모든 상품은 무료로 배송되고 와우회원에게는 무료 반품(30일 이내)혜택이 제공된다. 알럭스 관계자는 “시즌에 맞춘 다양한 글로벌 명품 패션 상품을 기간 한정으로 구성했다”며 “고객이 알럭스 패션을 편리하게 경험할 수 있도록 지속적으로 셀렉션을 확장하겠다”고 말했다."
"내달 2일부터 국세 카드수수료 인하…""160억원 경감 효과""",https://n.news.naver.com/mnews/article/001/0015760977,"신용카드 0.8→0.7%로 인하…영세업자는 0.4%로 절반 낮춰 지난 8월 18일 열린 국세청과 소상공인 연합회간 '세정지원 간담회' [국세청 제공. 재판매 및 DB 금지] (세종=연합뉴스) 송정은 기자 = 다음 달 2일부터 국세 신용카드 납부 수수료율이 0.8%에서 0.7%로, 체크카드 수수료율은 0.5%에서 0.4%로 일괄 0.1%p 낮아진다. 영세 사업자가 부가가치세·종합소득세를 신용카드로 납부할 시에는 0.8%에서 0.4%로 절반 낮아지고, 체크카드는 0.5%에서 0.15%로 0.35%p 인하된다. 국세청은 이런 내용의 국세 납부대행 수수료율 인하안을 지난 8월 결정·승인하고 지난달 말 국세청장 고시 개정을 거쳐 다음 달 2일부터 적용한다고 25일 밝혔다. 추가 인하되는 영세사업자는 부가가치세의 경우 간이과세자, 종합소득세의 경우 직전년도 귀속분을 추계 또는 간편장부로 신고한 사업자가 대상이다. 개인과 사업자별로 적용되는 납부수수료율은 내달 2일부터 국세청 홈택스에서 확인할 수 있다. 국세 카드 납부는 지난해 기준 약 428만건, 금액으로는 약 19조원 수준이다. 납세자들이 부담한 수수료는 약 1천500억원으로 집계됐다. 국세청은 납부수수료율 인하로 신용카드 기준 약 160억원의 수수료 경감 효과가 있으며 일시적인 자금난으로 국세를 카드로 납부하는 납세자들의 부담이 덜어질 것이라고 기대했다. [표] 국세 납부대행수수료율 인하 * 단, 연간 총수입금액 1천억원 이상 납세자는 현행 유지 [자료: 국세청] sje @ yna.co.kr"
"""티켓 취소했는데 환불 안 돼""…공연 관련 소비자 불만 급증",https://n.news.naver.com/mnews/article/422/0000805353,"[한국소비자원 제공] 최근 일부 티켓 예매사이트에서 일시적인 시스템 오류 등으로 환급이 지연되면서 지난달 공연 관련 소비자 피해 상담 건수가 급증한 것으로 나타났습니다. 한국소비자원과 한국소비자단체협의회는 오늘(25일) 1372소비자상담센터를 통해 접수된 소비자상담 사례를 빅데이터 시스템으로 분석한 결과를 발표하며 이같이 밝혔습니다. 지난 한 달 사이 상담 증가 폭이 큰 품목은 '각종공연관람(91.0%)', '점퍼·재킷류(87.8%)', '의류·섬유(17.4%)'였습니다. 공연 관련 상담은 티켓 예매사이트에서 취소 이후 환급이 지연됐다는 내용이 많았습니다. 점퍼·재킷류 상담은 냄새·변색 등의 품질 관련이 많았고, '의류·섬유'는 배송 및 환급 지연 등의 소비자 불만이 대부분이었습니다. [한국소비자원 제공] 상담이 많았던 품목은 '항공여객운송서비스', '헬스장', '휴대전화·스마트폰' 등이었습니다. 특히 스마트폰 관련 상담은 휴대전화 판매업체의 배송 지연과 연락 두절로 인한 상담이 늘어나면서 3위에 올랐습니다. 연령대별로 살펴보면 20대는 '휴대전화·스마트폰', 30~40대는 '항공여객운송서비스',  50대 이상에서는 '침향 등 각종건강식품'이 가장 많았습니다. 작년 대비 상담이 증가한 품목은 '과일·과일가공식품(99.1%)', '휴대폰·스마트폰(66.5%)', '호텔·펜션(48.8%)' 등이었습니다. '과일·과일가공식품'은 추석 선물로 배송된 과일의 변질 등 품질 관련 상담이 많았고, '호텔·펜션'은 예약 취소 시 환급을 거부하거나 과도한 위약금을 부과한다는 내용이 대부분이었습니다. 지난해 대비 상담 건수가 감소한 품목은 '상조서비스( -39.9 %)', '캐주얼바지( -30.3 %)', '각종일반화장품( -24.7 %)' 등이었습니다. 이는 작년 특정 상조사업자의 폐업으로 인해 관련 상담이 증가했다가 올해 감소한 데 따른 것으로 풀이됩니다. 한편 지난달 접수된 소비자상담은 총 48,117건으로, 전월 대비 18.0%, 전년 동월 대비 4.3% 감소했는데, 긴 추석 연휴로 실제 상담 가능한 일수가 줄어든 영향으로 분석됩니다. 소비자원은 ""소비자 피해가 발생할 경우 거래내역, 증빙서류 등을 갖춰 1372소비자상담센터  또는 소비자24를 통해 상담을 신청할 수 있다""고 밝혔습니다. #한국소비자원 #한국소비자단체협의회 #티켓 #소비자 연합뉴스 TV 기사문의 및 제보 : 카톡/라인 jebo23"
"이마트, 창립 32주년 기념 역대급 할인 릴레이 '고래잇 페스타'",https://n.news.naver.com/mnews/article/119/0003029290,"이마트 창립 32주년 기념 '고래잇 페스타' 포스터.ⓒ이마트 [데일리안 = 이나영 기자] 이마트는 창립 32주년을 맞아 오는 27일부터 12월10일까지 14일 간 ‘고래잇 페스타’를 열고 역대급 할인 릴레이에 돌입한다고 25일 밝혔다. 고래잇 페스타는 이마트의 전략적 가격투자를 통해 장바구니 필수 아이템을 파격가에 제공하는 대규모 할인행사다. 압도적인 상품력과 가격 경쟁력으로 매 행사마다 두 자리 수 매출 신장을 기록하는 등 대박 행진을 이어가고 있다. 이번 고래잇 페스타는 ‘빅 러브세일’을 테마로 32년 간 고객 사랑에 대한 감사의 의미를 담아역대 최장 기간인 14일 간 할인 판매한다. 대부분의 신선·가공식품 및 일상용품은 SSG 닷컴 이마트몰에서도 동일한 혜택가로 구매할 수 있다. 우선 이달 27일부터 12월1일 5일 간, 반값 삼겹살부터 조개, 딸기 등 엄선된 인기 품목을 초특가에 판매한다. 매 행사마다 완판 행진을 이어온 국내산 삼겹살은 200톤 규모를 확보했으며, 행사카드로 전액 결제 시 반값에 판매한다. SSG 닷컴에서는 11월 27일부터 28일까지 2일 간 구매할 수 있다. 가공식품도 대폭 할인에 나선다. 볶음김치의 매콤달콤한 맛을 조화롭게 담은 농심의 글로벌 공략 신제품 ‘신라면 김치볶음면(4개입)’은 4880원에 이마트 단독 판매한다. 켈로그 인기 시리얼 10종과 대상 종가김치, CJ 비비고 김치 15종 등은 2개 이상 구매 시, 50% 할인 혜택을 제공한다. 이마트 창립 32주년 기념으로 해외 유명 와이너리와 협업해 한정수량 제작한 리미티드 와인도 선보인다. ‘1865 리미티드 셀렉션 아티잔 까버네소비뇽’은 21% 할인된 2만9800원, ‘까테나 자파타 32주년 에디션(말벡·샤도네이)’는 33% 할인된 2만4800원에 선보인다. 인기 디지털 기기도 득템 할 수 있는 기회다. 12월1일부터 이마트앱을 통해 TV 와 태블릿의 장점을 결합한 24인치 스마트 디스플레이 ‘ Great 포터블 스크린’을 전용 가방 무료 혜택을 포함한 49만9000원에 사전 예약 판매한다. 또한 이마트 에이스토어에서는 오는 12월10일까지 아이폰 17 시리즈와 아이폰 에어 전 품목을 행사카드로 전액 결제 시, 최대 18개월 무이자 혜택과 함께 7만5000원 상당의 정품 케이스를 100원에 판매한다. 고객 참여형 이벤트와 혜택도 풍성하게 준비했다. 총 상금 2000만원 규모의 고객 참여형 공모전 ‘고래잇 메이커스 콘테스트’를 진행한다. 12월7일까지 생성형 AI , 공예, 그림 등 형식 제한 없이 나만의 ‘고래잇’ 캐릭터를 만들어 지정 해시태그와 함께 인스타그램에 게시하면 참여할 수 있다. 이 밖에도 이마트는 12월2일부터 10일까지 9일 간 새로운 상품과 차별화된 혜택으로 무장한 창립기념 ‘고래잇 페스타’의 두번째 할인 릴레이를 이어간다. 기간 별로 다양한 신선식품부터 대형가전까지 초특가에 선보인다. 한우 등심, 냉장 찜갈비, 황제전복, 햇부사 보조개 사과 등 신세계포인트 적립 시, 반값 판매할 계획이다. 대형 가전도 구매 금액에 따라 최대 80만원의 상품권 추가 증정 이벤트로 진행해 더욱 알뜰한 쇼핑이 가능하다. 정양오 이마트 전략마케팅본부장은 “지난 32년 동안 이마트를 이용해주신 고객 여러분의 성원에 보답하고자 이번 고래잇 페스타에 역대급 규모의 혜택을 담았다”며 “앞으로도 압도적인 가격 경쟁력을 기반으로 생활 물가 부담을 실질적으로 낮추며 고객 만족을 더욱 강화할 것”이라고 말했다."
'온라인 쇼핑' 1위…카드데이터로 본 대구·경북 소비 형태,https://n.news.naver.com/mnews/article/421/0008623712,"동북지방통계청 조사…남성 교통·여성 온라인쇼핑 ↑ 업종별 카드소비액 구성비 변화.(동북지방통계청 제공. 재판매 및 DB 금지) (대구=뉴스1) 김종엽 기자 = 대구와 경북지역의 카드소비액 중 온라인쇼핑이 가장 큰 비중을 차지한 것으로 나타났다. 25일 동북지방통계청의 '카드데이터로 본 소비 형태' 분석 결과를 보면 대구의 지난해 업종별 카드소비액은 온라인쇼핑이 35%로 가장 많았고, 종합소매(23.3%), 음식·숙박(11.9%) 순이었다. 2020년과 비교하면 온라인쇼핑과 보건의료가 각각 5.1%p, 1.1%p 증가한 반면 종합소매와 음식·숙박은 4.3%p, 0.4%p 감소했다. 남성과 여성의 카드소비액 비중을 업종별로 보면 남성은 운송교통(7.7%p), 음식·숙박(5.3%p) 등에서 여성보다 높고, 여성은 온라인쇼핑(9.5%p), 전문소매(2.4%p) 등에서 남성보다 높게 나타났다. 또 연령대별로는 40대(20대 50.6%, 30대 51.4%, 40대 43.2%) 이하에서는 온라인쇼핑 비중이, 60대(60대 13.2%, 70대 24.1%) 이상에서는 보건의료 비중이 타 연령대보다 높았다. 하루 평균 카드소비액 비중은 평일 59.5%로 휴일(40.5%)보다 높고, 업종별로는 보건의료(8.2%p)와 온라인쇼핑(3.5%p)은 평일 비중이, 종합소매(12.7%p)와 음식·숙박(4.5%p)은 휴일 비중이 높은 것으로 조사됐다. 대구 시민의 타 지역 카드소비액 비중은 운송교통(32.1%), 종합소매(30%) 순이었고, 타 지역민의 대구 소비는 종합소매(41.2%), 보건의료(22%) 순으로 높았다. 대구 시민은 경북(42.4%), 수도권(30.1%), 동남권(12.3%) 순으로 소비가 많았고, 타 지역민의 대구 소비는 경북(60.8%), 동남권(15.9%), 수도권(15.4%) 순으로 많았다. 대구의 올해 19세 이상 소비생활 만족도는 20.7%로 2017년 대비 7.2%p 높아졌다. 경북의 지난해 업종별 카드소비액은 온라인쇼핑(27%), 종합소매(23.4%), 운송교통(15.1%) 순이었으며, 남성은 운송교통(13.7%p)과 음식·숙박(5%p), 여성은 온라인쇼핑(13.5%p)과 교육(3.6%p) 비중이 높았다. 하루 평균 카드소비액 비중은 휴일(39.9%)보다 평일(60.1%)이 높았다. 평일에는 보건의료(7.4%p)와 운송교통(3.7%p), 휴일에는 종합소매(12.5%p)와 음식·숙박(5.3%p) 비중이 높은 것으로 집계됐다. 경북의 올해 19세 이상 소비생활 만족도는 22.4%로 2017년 대비 6.9%p 높아졌다."
