title,link,content
무신사 누적 영업익 벌써 700억..올해도 연매출 1조 넘긴다,https://n.news.naver.com/mnews/article/008/0005282870,"패션 플랫폼 무신사가 업계 비수기로 꼽히는 3분기에도 선전하며 연매출 1조원 달성을 눈앞에 두게 됐다. 무신사는 연결재무제표 기준 3분기 영업이익이 전년 동기 대비 7.3% 증가한 118억원을 기록했다고 25일 밝혔다. 같은 기간 매출액은 3024억원으로 11.8% 늘어났다. 다만 당기순손실이 145억원 발생했다. 올해부터 상환전환우선주( RCPS )를 부채로 인식하는 회계정책 변화로 인한 영향이다. 무신사 관계자는 ""이는 장부상 이자비용을 반영한 것이며 실제 현금 유출과는 무관하다""고 설명했다. 누적으로 보면 올 3분기까지 영업이익은 706억원으로 전년 동기 대비 20.1% 증가했다. 누적 매출도 9730억원으로 지난해 같은 기간(8196억원)보다 1500억원 이상 늘어났다. 현재 추세라면 올해도 연매출 1조원을 무난하게 넘어설 것으로 보인다. 무신사는 7~9월 계절적 요인(비수기)과 대외 소비심리 위축에도 불구하고 온·오프라인의 고른 성장을 앞세워 매출과 영업이익을 동시에 끌어올렸다. 우선 3분기에 오프라인 거점을 확대하기 위해 △무신사 스탠다드 더리버몰 강동 △무신사 스탠다드 스타필드마켓 일산 △29CM 이구키즈 성수 △29CM 이구어퍼스트로피 성수 등 신규 매장을 열었다. 또 브랜드 유통 전문 자회사인 무신사 트레이딩을 통해 언더커버·와이쓰리( Y-3 ) 등 글로벌 패션 브랜드의 한국 내 공식 오프라인 매장을 선보이기도 했다. 무신사는 특히 글로벌 패션 시장 공략을 위해 공격적인 투자를 단행했다. 지난 9월 중국 최대 B2C (기업과 소비자간 거래) 이커머스(전자상거래) 플랫폼인 '티몰( Tmall )'에 무신사 스탠다드 플래그십 스토어를 냈고, 지난달에는 '무신사 스토어' 공식몰도 개점했다. 티몰 오픈에 맞춰 중국 현지에 선제적으로 재고를 비축한 덕에 지난달 중순부터 한달여간 진행된 '광군제'에 참여하면서 온라인 비즈니스를 개시했다. 오는 12월 상하이에 무신사 스탠다드 해외 1호 매장과 K패션 브랜드를 소개하는 '무신사 스토어 상하이' 편집숍 등을 잇따라 선보이며 오프라인 시장 공략에도 본격적으로 나선다. 아울러 또다른 글로벌 핵심 거점인 일본 내 영향력을 확대하기 위한 투자에도 집중했다. 지난 10월에 도쿄 시부야에서 80여개 국내 브랜드를 소개하는 팝업 스토어(임시매장)를 3주간 운영하기 위해 인적·물적 자원을 투입했다. 이달초부터 연동한 현지 최대 패션 이커머스 플랫폼인 조조타운과의 협업을 위해 시스템 개발·운영 등과 같이 필요한 지원도 확대했다. 이를 바탕으로 올 3분기까지 누적 패션 수출액을 전년 대비 3배 이상 늘렸다. 박준모 무신사 대표는 ""3분기는 연말 쇼핑 성수기를 앞두고 상대적으로 체력을 비축해 가을·겨울 시즌 재고를 구비하고 글로벌 시장 진출에 대비하기 위한 투자에 집중하는 시기였다""며 ""12월에 중국 상하이에 브랜드 최초의 글로벌 오프라인 스토어 오픈을 기점으로 내년을 해외 공략의 원년으로 삼을 수 있도록 발판을 마련할 것""이라고 말했다."
"형지, 미래사업총괄에 두산 출신 이준길 사장 영입 ""형지엘리트 新사업 가속화 기대""",https://n.news.naver.com/mnews/article/003/0013620580,"패션그룹형지의 미래사업총괄로 영입된 이준길 사장 (사진=패션그룹형지 제공) *재판매 및 DB 금지 [서울=뉴시스] 이혜원 기자 = 패션그룹형지는 그룹 및 주요 계열사의 중장기 성장 전략을 강화하기 위해 미래사업총괄로 이준길 사장을 영입했다고 25일 밝혔다. 이준길 신임 사장은 1992년 행정고등고시(법무행정)에 합격해 제36기로 연수원을 졸업한 뒤 경제기획원 행정사무관으로 공직에 입문했으며, 14년간 공정거래위원회에서 근무했다. 김정관 산업부 장관과 여한구 통상교섭본부장, 이형일 기재부 차관 등과 행시 36기 연수원 동기다. 공직 이후에는 두산그룹으로 자리를 옮겨 약 10년간 임원으로 재직하며 두산밥캣, 두산밥콕 등 대형 M&A (인수합병)를 통해 신사업 확장과 글로벌 사업 재편에서 핵심적 역할을 수행했다는 평이다. 또한 동반성장지원팀장을 맡아 협력사와의 공정거래 및 상생 활동을 총괄했고, 한국공정거래조정원 약관분쟁조정협의회 위원으로도 활동했다. 이번 영입은 형지그룹이 추진 중인 미래 성장동력 확보 전략의 일환이라고 회사 측은 설명했다. 특히 형지엘리트가 준비해 온 AI (인공지능)·로봇 기반의 작업복·특수복 신사업을 국내외 시장으로 확장하는 데 중요한 기여를 할 것으로 기대된다고 덧붙였다. 아울러 이 사장은 두산에너빌리티 경력을 바탕으로 형지엘리트가 벨기에 겐트대학교 글로벌캠퍼스와 공동으로 설립한 연구소를 통해 추진중인 신재생 및 친환경 에너지 연구, 탄소 감축 기술 기반 구축에도 추진력을 더할 것으로 보인다. 이어 ""이 사장의 M&A 역량과 공정거래 전문성은 형지가 추진하는 AI 기반의 웨어러블 로봇과 신기술 및 신재생 에너지 등 미래사업 전반의 경쟁력을 한층 끌어올릴 것""이라며 ""특히 형지엘리트의 신사업 확대에 강력한 시너지가 될 것""이라고 말했다."
"에누리 가격비교, ‘가족 건강 위한 현명한 건기식 구매’ 캠페인",https://n.news.naver.com/mnews/article/119/0003029396,"식약처 인증 건기식만 엄선해 성분부터, 섭취 방법, 최저가 비교 ⓒ에누리 가격비교 [데일리안 = 최승근 기자] 에누리 가격비교가 가족 건강을 위한 현명한 건기식(건강기능식품) 구매를 지원한다. 건기식의 부당광고, 저품질 및 가품으로 인한 피해를 방지하고 원스톱 구매 인프라를 선도한다는 전략이다. 커넥트웨이브 계열사 써머스플랫폼이 운영하는 '에누리 가격비교'가 가족의 건강을 지키는 현명한 건기식 구매를 주제로 “진짜를 원한다면? 에누리 건강플러스” 캠페인을 전개한다고 25일 밝혔다. 내달 16일까지 진행되는 이번 캠페인은 에누리 가격비교가 지난해 자체 개발해 운영하고 있는 ‘건강 Plus 전문관’의 우수성을 알리고 올바른 건기식 구매 문화 정착에 앞장서기 위해 마련됐다. 에누리는 건강 Plus 전문관의 차별화된 혜택을 고객이 쉽게 알 수 있도록 엄마가 선택한 진짜 건강기능식품 전문관이라는 홍보 영상을 제작하고 소비자와 소통 확대를 위한 이벤트도 실시한다. 영상을 시청하고 해답을 맞히는 참여형 방식의 퀴즈 이벤트로 정답자에게는 추첨을 통해 갤럭시 위치8부터 풀리오 프리미엄 마사지 매트, 신세계 상품권(10만원) 등 다양한 경품을 제공한다. 건강 Plus 전문관은 식약처에서 인증한 건기식만을 엄선해 유효성분부터 섭취 방법, 최저가 비교 등을 제공해 소비자가 정확하고 신뢰할 수 있는 제품 구매를 돕는 역할을 목표로 운영하고 있다. 특히 동일 상품의 가격비교로 최저가 구매를 돕는 역할을 넘어, 편리하고 정확한 제품 선택 기준 제공에 초점을 두고 있다. 이를 위해 성인, 유아, 청소년, 시니어 등 연령 및 성별에 따른 제품 탐색부터 영양보충, 피부건강, 체지방 감소와 같은 목적형 검색까지 필터 고도화에 집중하고 있다. 최근에는 식약처에서 인정한 핵심 성분의 총함량을 하루 환산가 기준으로 비교하는 ‘함량당 최저가’ 정렬 서비스도 선보이며 가성비 제품을 선호하는 구매 흐름에도 발빠르게 대응하고 있다. 에누리닷컴 관계자는 ""이번 캠페인은 주로 가족 건강을 담당하는 50대 여성 액티브 시니어 세대가 유튜브, 약국, 홈쇼핑 등에서 접하던 건강 정보의 연장선상에서 건강 Plus 전문관이 자연스럽게 인식될 수 있도록 구성했다""면서 ""앞으로 건강 Plus 전문관이 일상 속 가족의 건강을 챙기는 동반자로 자리매김해 나가겠다""고 말했다."
부산 소비자 경제 심리 7개월 연속 낙관적,https://n.news.naver.com/mnews/article/001/0015761380,"부산 부전시장 찾은 시민들 [연합뉴스 자료사진] (부산=연합뉴스) 민영규 기자 = 부산지역 소비자들이 느끼는 경제 상황이 7개월 연속 낙관적인 것으로 나타났다. 25일 한국은행 부산본부에 따르면 11월 부산지역 소비자심리지수( CCSI )는 116.2를 기록했다. 경제 상황에 대한 심리를 종합적으로 나타내는 소비자심리지수는 100을 기준으로 100보다 크면 경제 상황이 장기 평균보다 낙관적임을, 100보다 작으면 비관적임을 의미한다. 부산 소비자심리지수는 지난 4월 96.5로 기준치를 밑돌았으나 5월 103.4, 6월 110.5, 7월 113.3, 8월 115.0, 9월 114.2, 10월 112.7, 11월 116.2로 7개월 연속 100을 웃돌았다. 부산 소비자심리지수 그래프 [한국은행 부산본부 제공] 가계의 재정 상황을 나타내는 현재생활형편지수는 10월 96보다 1포인트 상승한 97을 기록했고, 생활형편전망지수도 99에서 102로 올랐다. 가계수입전망지수는 104로 앞 달보다 1포인트 상승했다. 물가 상황에 대한 인식 지표인 물가수준전망지수는 앞 달 142보다 1포인트 하락한 141을 기록했다. youngkyu @ yna.co.kr"
"메가MGC커피, 라이즈 쇼케이스에 커피차 지원",https://n.news.naver.com/mnews/article/018/0006171358,"싱글 '페임' 발매 기념 음료·간식 제공 [이데일리 신수정 기자]메가 MGC 커피가 지난 24일 예스24라이브홀에서 열린 그룹 라이즈( RIIZE )의 두 번째 싱글 ‘페임’( Fame ) 발매 기념 쇼케이스 현장에 커피차를 지원했다고 25일 밝혔다. 메가 MGC 커피, 라이즈 쇼케이스에 커피차 깜짝 지원 (사진=메가 MGC 커피) 메가 MGC 커피는 현장을 찾은 팬들에게 ‘제로 부스트 에이드’와 ‘햄앤치즈샌드위치’를 제공했다. 제로 부스트 에이드는 타우린 1000mg을 함유한 에너지 드링크다. 이번 행사는 메가 MGC 커피가 SM 엔터테인먼트와 협력해 진행 중인 ‘ SMGC 캠페인’의 하나다. 봄 시즌 ‘하트투하트’( Hearts2Hearts )와 여름 시즌 ‘엔시티 위시’( NCT WISH )에 이어 세 번째 진행된 행사다. SMGC 캠페인은 팬덤 문화와 브랜드를 결합해 시너지를 내기 위한 협업이다. 현장을 찾은 팬들은 “추운 날씨 속에서 커피차가 큰 에너지가 됐다”, “음료와 함께 받은 라이즈 컵 홀더까지 소중하다”는 반응을 보였다. 메가 MGC 커피 관계자는 “라이즈의 두 번째 싱글 앨범 발매를 진심으로 축하하며, 새로운 챕터의 시작과 함께 응원을 보낼 수 있어 진심으로 기쁘게 생각한다”며 “앞으로도 팬들과 아티스트가 특별한 순간을 함께할 수 있도록 다양한 이벤트를 지속적으로 선보일 것”이라고 말했다."
계란 산업 융합 페스티벌 ‘에그테크코리아 2025’ 19일 개막,https://n.news.naver.com/mnews/article/119/0003029392,"60개사 100부스 참여 12월19일부터 21일까지 서울 양재 aT 센터 제1전시장서 개최 ⓒ에그테크코리아 2025 대회위원회 [데일리안 = 최승근 기자] 국내 계란 식품·산업·웰니스를 아우르는 대형 계란 박람회 ‘에그테크코리아 2025( EggTech Korea 2025)’가 오는 12월19일부터 21일까지 서울 양재 aT 센터 제1전시장에서 개최된다. 이번 행사는 ‘계란·미래 ·K- 푸드·웰니스’를 핵심 키워드로, 60개사 100부스가 참여하는 대규모 B2C·B2B 융합형 페스티벌로 꾸며진다. 특히 1270만 구독자를 보유한 국내 대표 먹방 크리에이터 쯔양이 홍보대사로 나서며, 의학 유튜브 채널 ‘닥터프렌즈’(140만 구독자)가 건강·식품안전 관련 토크콘서트에 참여해 관심이 집중되고 있다. 에그테크코리아 2025는 스마트 양계·스마트팜 기술, 동물복지 및 HACCP 생산 공정, 로컬푸드 개발, 친환경 패키징, 유정란·디저트 등 건강한 먹거리 산업의 전 과정을 대중에 공개하는 국내 최초의 전시회다. 가족·청소년 체험형 프로그램으로 어린이 스마트팜 체험존, 먹거리 안전 클래스, 친환경 패키징 체험, 로컬 베이커리·디저트 마켓 등 일반 관람객이 직접 참여할 수 있는 콘텐츠도 마련됐다. 홍보대사 쯔양은 개막일인 19일 주요 부스를 소개하는 현장 브이로그를 촬영할 예정이며, 닥터프렌즈는 ‘계란을 통한 건강한 라이프 스타일’을 주제로 12월 20일 에그테크 토크콘서트를 진행한다. 대회위원회는 “대중성과 전문성이 결합된 실질적 K- 푸드·웰니스 페스티벌”이라며 “식품 안전, 건강한 먹거리, 스마트팜 분야에 대한 국민적 관심을 높이는 계기가 될 것”이라고 강조했다. 행사에는 스마트계란 IoT· 센서 제조업체, 로컬푸드 브랜드, 베이커리, 친환경 디자인 기업 등 다양한 식품·농업·환경 기업이 참여한다. 주요 참가 기업으로는 에그텍, 한밭 IoT , 축산물품질평가원(스마트양계·식품안전), 나눔베이커리, 다원스마트팜(디저트·로컬푸드), 마린이노베이션, 파코팩, 디에스필텍(친환경·패키징) 등이 포함되며, 홍삼 및 건강식품 브랜드 다수도 함께한다. 대회위는 “참가 기업에게는 실수요자와 만나는 장을, 관람객에게는 미래식품 산업을 체험할 기회를 제공할 것”이라고 설명했다. 에그테크코리아 2025는 에그테크코리아대회위원회가 주최하고 프리미엄 경제신문 이투데이가 주관하며, 농림축산식품부가 후원한다. 행사는 2025년 12월 19일부터 21일까지 양재 aT 센터 제1전시장에서 개최되며, 에그테크코리아 어워드, 투자 IR 데모데이, 에그테크 심포지움 등 산업성과 대중성을 모두 갖춘 프로그램이 마련된다. 사전 등록자를 대상으로는 대전 대표 베이커리 ‘성심당’의 순수 마들렌을 제공하며, 45년 달걀전문업체 조인몰 가입 시에는 백색 신선란 20구와 교환 가능한 1만5000 포인트를 지급한다. 또한 현장 이벤트 ‘황금알을 잡아라(애그트레저)’에서는 매일 추첨을 통해 당첨자에게 황금알 한 돈이 주어진다. 참가 규모는 총 60개 기업, 100부스로 구성되며, 자세한 문의는 에그테크코리아대회위원회로 하면 된다."
"파크 하얏트 서울 '코너스톤', 오스피탈리타 이탈리아나 인증 획득",https://n.news.naver.com/mnews/article/031/0000983812,"""글로벌 기준에 부합하는 전통 이탈리안 레스토랑 입증"" 파크 하얏트 서울의 레스토랑 '코너스톤( Cornerstone )'이 지난 17일 주한 이탈리아 상공회의소로부터 정통 이탈리안 레스토랑 국제 인증인 '오스피탈리타 이탈리아나( Ospitalità Italiana )'를 획득했다고 25일 밝혔다. 오스피탈리타 이탈리아나는 이탈리아의 전통성과 고유성을 보호하고 세계에 확산하기 위해 마련된 공식 인증으로, 이탈리아 국립 관광원( ISNART )과 이탈리아 상공회의소 연합( Unioncamere )이 주관한다. 전 세계 60여 개국 약 2200개 이탈리안 레스토랑을 대상으로 정통성, 메뉴 구성, 원재료의 진정성, 서비스 품질, 공간 아이덴티티 등을 종합적으로 평가해 우수 레스토랑에 한해 인증을 부여한다. 코너스톤 레스토랑 전경. [사진=파크하얏트] 최보현 셰프와 김효진 팀장, 조르지오 사보이니 ( Giorgio Savoini )가 이끄는 코너스톤은 계절별 지역성을 반영한 현대적 이탈리아 요리, 정통 식재료 활용, 전문 소믈리에의 와인 페어링 역량 등에서 높은 평가를 받았다. 맥시밀리안 프로비스( Maximilien Provis ) 파크 하얏트 서울 식음료부 이사는 ""서울에서도 이탈리아 미식의 정수를 경험할 수 있도록 셰프팀과 서비스팀, 소믈리에의 역량을 꾸준히 강화해온 결과""라며 “앞으로도 정통성과 창의성을 모두 갖춘 품격있는 이탈리아 다이닝 경험을 선보일 것""이라고 전했다. 코너스톤은 연말 시즌을 맞아 오는 12월 1일부터 12월 31일까지 런치와 디너로 구성된 페스티브 다이닝 메뉴를 선보일 예정이다. 파크하얏트 관계자는 ""코너스톤은 이번 인증으로 글로벌 기준에 부합하는 정통 이탈리안 레스토랑으로 자리매김했다""고 말했다."
커머스 브랜드 육성 기업 '부스터스' 새로운 CI 공개,https://n.news.naver.com/mnews/article/031/0000983811,"브랜든, 이퀄베리 흥행으로 4년 만에 누적 매출 2500억원 커머스 브랜드 육성 기업 부스터스가 '커머스의 새로운 기준( The New Standard In Commerce )'이란 의미를 담은 새로운 기업 아이덴티티( CI )를 공개했다고 25일 밝혔다. 부스터스는 2019년 설립돼 판매와 재고관리 등에 어려움을 겪는 커머스 기업들을 인수해 육성하는 육성업체인 '브랜드 애그리게이터' 기업이다. 지난 4년간 축적한 34억여 개의 커머스 데이터를 기반으로 커머스 브랜드를 육성하고 있다. 2023년부터 최윤호 단독 대표 체제로 바뀌면서 여러 브랜드를 육성하는 일보다 성장 가능성이 높은 소수의 브랜드에 집중하고 있다. 현재 짐 정리 대표 브랜드인 '브랜든( Branden )'과 글로벌 스킨케어 브랜드 '이퀄베리( Eqqualberry )'를 운영하고 있으며, 이들 브랜드를 기반으로 사업 4년 만에 누적 매출 2500억원을 돌파했다. 부스터스 CI . [사진=부스터스] 이번 리브랜딩은 부스터스의 슬로건 '커머스의 새로운 기준'을 중심으로, 각 분야의 전문가들이 브랜드의 성공을 이끌겠다는 포부를 담았다. 부스터스는 △데이터 기반의 안정감 △시장 변화에 발 빠르게 적응하는 유연함 △고속 성장으로 이어지는 팀의 기민함이라는 세 가지 핵심 가치를 정의하고, 이를 로고 디자인을 포함한 새로운 CI 에 반영했다. 부스터스는 기업 홈페이지도 새로운 CI 에 맞춰 전면 리뉴얼했다. 이번 개편은 지난 4년간 축적한 34억여 개의 커머스 데이터 기반의 자체 개발 시스템의 안정성을 강조하면서, 브랜든과 이퀄베리의 개성을 살린 브랜드 경험( BX·Brand eXperience )을 강화하는 데에 중점을 두었다. 홈페이지는 국문·영문 두 가지 버전으로 제공돼 글로벌 접근성을 한층 높였다. 최윤호 부스터스 대표는 ""이번 리브랜딩은 짧은 시기에 초고속 성장세를 이어온 부스터스가 내년을 글로벌 확장 원년으로 삼고 담대하고 원대한 도전을 하기 위한 시작""이라며 ""커머스 시장의 판도를 바꿀 것""이라고 말했다."
"창립 32주년…이마트, '고래잇 페스타' 진행",https://n.news.naver.com/mnews/article/001/0015761367,(서울=연합뉴스) 25일 이마트 용산점에서 모델들이 '고래잇 페스타' 할인 상품을 소개하고 있다. 이마트는 창립 32주년을 맞아 오는 27일부터 다음 달 10일까지 '고래잇 페스타'를 진행한다. 2025.11.25 [이마트 제공. 재판매 및 DB 금지] photo @ yna.co.kr
"창립 32주년…이마트, '고래잇 페스타' 진행",https://n.news.naver.com/mnews/article/001/0015761365,(서울=연합뉴스) 25일 이마트 용산점에서 모델들이 '고래잇 페스타' 할인 상품을 소개하고 있다. 이마트는 창립 32주년을 맞아 오는 27일부터 다음 달 10일까지 '고래잇 페스타'를 진행한다. 2025.11.25 [이마트 제공. 재판매 및 DB 금지] photo @ yna.co.kr
"창립 32주년…이마트, '고래잇 페스타' 진행",https://n.news.naver.com/mnews/article/001/0015761364,(서울=연합뉴스) 25일 이마트 용산점에서 모델들이 '고래잇 페스타' 할인 상품을 소개하고 있다. 이마트는 창립 32주년을 맞아 오는 27일부터 다음 달 10일까지 '고래잇 페스타'를 진행한다. 2025.11.25 [이마트 제공. 재판매 및 DB 금지] photo @ yna.co.kr
"CJ제일제당, '김치대전' 기획전⋯""최대 38% 할인""",https://n.news.naver.com/mnews/article/031/0000983810,"'김치의 날' 맞아 기획⋯오는 26일까지 진행 CJ 제일제당이 오는 26일까지 공식몰 CJ 더마켓에서 '김치대전' 기획전을 진행한다고 21일 밝혔다. 이번 할인 행사는 지난 22일 '김치의 날'을 맞아 기획됐다. CJ 제일제당이 오는 26일까지 CJ 더마켓서 '김치대전' 기획전을 진행한다. [사진= CJ 제일제당] 이번 김치대전에서는 스테디셀러 '비비고 포기배추김치'를 비롯해 '비비고 총각김치', '비비고 열무김치', 그리고 최근 화끈한 매운맛으로 인기를 끌고 있는 '습' 시리즈까지 다양한 제품을 최대 38% 할인된 가격에 만나볼 수 있다. '습 실비김치'와 '습 실비 파김치', '습 맵찔이 실비김치' 3종을 최대 25% 할인한다. 보쌈 등의 요리에 곁들이기 좋은 '비비고 묵은지'와 '비비고 보쌈김치', 아이도 함께 즐길 수 있는 '비비고 백김치', '비비고 우리아이한입 김치' 등의 제품도 할인 품목에 포함됐다. 김장철을 앞두고 '비비고 베이직 포기배추김치 10kg' 대용량 제품도 25% 할인가에 제공된다. 주문 후 생산돼 바로 고객에게 배송되는 '생생배송' 제품으로, 갓 담근 신선한 김치를 선호하는 소비자들에게 특히 주목받을 것으로 기대된다. 또한 '블랙 프라잉데이' 기획전과 맞물려 최대 20% 중복 적용 가능한 쿠폰도 지급돼 소비자들에게 더욱 큰 혜택을 제공할 예정이다. CJ 제일제당 관계자는 ""이번 기획전을 통해 김치의 우수성을 알리고, 소비자들이 다양한 김치를 합리적인 가격에 만나볼 수 있는 기회를 제공하고자 한다""고 말했다."
"켄싱턴호텔 여의도, 웨딩홀 새 단장 오픈",https://n.news.naver.com/mnews/article/119/0003029388,"ⓒ이랜드파크 [데일리안 = 임유정 기자] 이랜드파크 켄싱턴호텔 여의도가 웨딩홀을 새롭게 단장해 오픈했다고 25일(화) 밝혔다. 켄싱턴호텔 여의도는 웨딩홀의 인테리어와 공간 구성을 리뉴얼하면서 개인화된 서비스를 강화해 ‘나만의 웨딩’을 실현하는 공간으로 새롭게 선보인다. 이번 리뉴얼은 개성과 감성을 중시하는 예비 부부의 최신 트렌드를 반영해 ‘커스텀&프라이빗( Custom &Private )’을 콘셉트로 진행됐다. 한강 전망을 배경으로 로맨틱한 분위기와 첨단 무빙 조명을 활용한 드라마틱한 연출 등 예비 부부가 선호하는 호텔 웨딩 요소들로 채웠다. 켄싱턴호텔 여의도 15층에 위치한 웨딩홀은 하우스 웨딩 느낌의 인테리어로 탁 트인 통창을 통해 채광과 개방감을 극대화해 로맨틱한 분위기를 느낄 수 있다. 또한 신랑 신부의 입장을 돋보이게 하는 무빙 조명은 버진 로드를 더욱 특별하게 만들어준다. 신부 대기실은 전체 분위기를 화이트 톤으로 리뉴얼하고, 커스텀 플라워 데커레이션을 더해 신부가 한층 더 돋보일 수 있도록 했다. 웨딩 메뉴는 양식, 퓨전 한식, 뷔페 등 다양한 구성으로 업그레이드해 취향에 따라 선택할 수 있다. 특히 켄싱턴호텔 여의도의 웨딩홀은 최소 50명부터 최대 300명까지 이용할 수 있어 최근 예비 부부가 선호하는 스몰 웨딩부터 규모 있는 예식까지 진행할 수 있다. 한편, 웨딩홀 리뉴얼을 기념해 오는 12월 30일(화)까지 ‘웨딩 리뉴얼 이벤트’를 진행한다. 웨딩 고객 방문 상담 시 ‘켄싱턴호텔 스페셜 기프트 박스’가 제공되며, 계약 고객은 100만원 상당의 웨딩 플라워 무료 업그레이드 혜택을 받을 수 있다. 켄싱턴호텔 여의도 웨딩 관계자는 “새롭게 리뉴얼한 웨딩홀은 서비스 경쟁력 강화와 고객 맞춤 연출 극대화를 목표로 진행했다”며 “호텔 웨딩의 품격을 유지하면서 웨딩홀, 메뉴, 서비스 등 모든 요소를 자유롭게 선택하는 나만의 웨딩을 경험할 수 있을 것""이라고 말했다."
